{
  "entry_resolution_schema_version": "2.0",
  "entry_resolution_id": "entry_983989e9506114f17a1970e462f3cae04df7c71c170ed1159e324738775555aa",
  "source_generation_id": "gen_ba28ea0729a5a466e2b347d63a249f348045cc2fc2ddfcab908352704950717c",
  "source_snapshot_id": "snap_c76c0aa7265f01393d3dbd900489094f4313a3c3b68811d71ca1669be2ec4462",
  "source_snapshot_path": "docs/generations/2026-08-06/gen_ba28ea0729a5a466e2b347d63a249f348045cc2fc2ddfcab908352704950717c/snapshot.json",
  "generated_at": "2026-08-07T18:01:34.797472+00:00",
  "records": [
    {
      "entity_id": "ent_bd329ec19d92b1afe4e5d2ec67f86d236e12538eedc90cd36f9ca2c5a4749afa",
      "route_candidate_id": "route_01ba25b25caf49a0b010f95703098c2c01328da5529ffc18a15ebf810dcc2441",
      "ticker": "SAFT",
      "status": "resolved",
      "first_tradable_at": "2026-08-07T13:30:00+00:00",
      "entry_price_timestamp": "2026-08-07T13:30:00+00:00",
      "entry_price": 103.45999908447266,
      "entry_price_type": "next_session_open",
      "timezone": "America/New_York",
      "resolved_at": "2026-08-07T18:01:34.797472+00:00"
    },
    {
      "entity_id": "ent_5825ee29241e6411dc5b499938e8d8f22fa46b25e7291407dc4a062fb0368e31",
      "route_candidate_id": "route_10c46c027687983c23ec8bf8bd9abd1f7dde053636c06db642c4321372624a96",
      "ticker": "PFGC",
      "status": "resolved",
      "first_tradable_at": "2026-08-07T13:30:00+00:00",
      "entry_price_timestamp": "2026-08-07T13:30:00+00:00",
      "entry_price": 114.12999725341797,
      "entry_price_type": "next_session_open",
      "timezone": "America/New_York",
      "resolved_at": "2026-08-07T18:01:34.797472+00:00"
    },
    {
      "entity_id": "ent_51cad241b252d612c0f35ac7d42f75e40773e1c380ea97dce3f6b5703bd329d0",
      "route_candidate_id": "route_269b13e07aea30dbd40d4c4761796c9310c688b398b35dc2eb58a56431ee96b1",
      "ticker": "UTZ",
      "status": "resolved",
      "first_tradable_at": "2026-08-07T13:30:00+00:00",
      "entry_price_timestamp": "2026-08-07T13:30:00+00:00",
      "entry_price": 14.140000343322754,
      "entry_price_type": "next_session_open",
      "timezone": "America/New_York",
      "resolved_at": "2026-08-07T18:01:34.797472+00:00"
    },
    {
      "entity_id": "ent_66442e86d55a0ab2beb7e95b5017feaf53ccd14034498fef70b29bb3591b4666",
      "route_candidate_id": "route_3fb75ddbbcc4f77ababce7e430c0e54acb97378abcfd773a84d3321aa81d4824",
      "ticker": "MKTX",
      "status": "resolved",
      "first_tradable_at": "2026-08-07T13:30:00+00:00",
      "entry_price_timestamp": "2026-08-07T13:30:00+00:00",
      "entry_price": 162.64999389648438,
      "entry_price_type": "next_session_open",
      "timezone": "America/New_York",
      "resolved_at": "2026-08-07T18:01:34.797472+00:00"
    },
    {
      "entity_id": "ent_e12254d99e0f88de679541eb1de1323b619ec40ce51e793fe46125736a5d7ca5",
      "route_candidate_id": "route_42c1f13583d0394640fe0e49d22725f9ada0013e1801ee8a61faffc7568eb1d0",
      "ticker": "ATKR",
      "status": "resolved",
      "first_tradable_at": "2026-08-07T13:30:00+00:00",
      "entry_price_timestamp": "2026-08-07T13:30:00+00:00",
      "entry_price": 93.83000183105469,
      "entry_price_type": "next_session_open",
      "timezone": "America/New_York",
      "resolved_at": "2026-08-07T18:01:34.797472+00:00"
    },
    {
      "entity_id": "ent_b1486962ac72c1bc6de1b2065dcf9f19eb2cdf7a65d53409575779ac42315603",
      "route_candidate_id": "route_43375f9e12c6d5f2633e17eafeb01f9e5968b86d90e3d968ee2b026b174aa941",
      "ticker": "REPL",
      "status": "resolved",
      "first_tradable_at": "2026-08-07T13:30:00+00:00",
      "entry_price_timestamp": "2026-08-07T13:30:00+00:00",
      "entry_price": 13.0,
      "entry_price_type": "next_session_open",
      "timezone": "America/New_York",
      "resolved_at": "2026-08-07T18:01:34.797472+00:00"
    },
    {
      "entity_id": "ent_badd69195ab5592fcf8975922a89d26a83a95fef271c01467f899186952bb946",
      "route_candidate_id": "route_480d8c008563a104c8d67dfca0bd41cab13d7f750b4dff05ef37508231dd398b",
      "ticker": "AXTA",
      "status": "resolved",
      "first_tradable_at": "2026-08-07T13:30:00+00:00",
      "entry_price_timestamp": "2026-08-07T13:30:00+00:00",
      "entry_price": 37.900001525878906,
      "entry_price_type": "next_session_open",
      "timezone": "America/New_York",
      "resolved_at": "2026-08-07T18:01:34.797472+00:00"
    },
    {
      "entity_id": "ent_bd91988b3f927f826f49ccd4f0cac115e4ae139b010ba0cb83e178e5337f1579",
      "route_candidate_id": "route_5cd20c4549e8b97cdda8f88262f9fa493d8ef1c20da60b505cdb79f4a055e6e6",
      "ticker": "IOVA",
      "status": "resolved",
      "first_tradable_at": "2026-08-07T13:30:00+00:00",
      "entry_price_timestamp": "2026-08-07T13:30:00+00:00",
      "entry_price": 6.5879998207092285,
      "entry_price_type": "next_session_open",
      "timezone": "America/New_York",
      "resolved_at": "2026-08-07T18:01:34.797472+00:00"
    },
    {
      "entity_id": "ent_d9c2f0000a7947d6509c7b67bca1ff4cce2c0e07195cde7a4a01ddef49572962",
      "route_candidate_id": "route_5d4a9eb4b0a28e90df21cf64436632265aa2491b529589ce31b9fd3b1d4a52af",
      "ticker": "PAYC",
      "status": "resolved",
      "first_tradable_at": "2026-08-07T13:30:00+00:00",
      "entry_price_timestamp": "2026-08-07T13:30:00+00:00",
      "entry_price": 216.94000244140625,
      "entry_price_type": "next_session_open",
      "timezone": "America/New_York",
      "resolved_at": "2026-08-07T18:01:34.797472+00:00"
    },
    {
      "entity_id": "ent_16b94999e4fcf23b1cfbcb6d2f7a650acf43f1142ecd87239a471fdb692255eb",
      "route_candidate_id": "route_5f505b891ff5a0c9d8282755db62954f36ce24ef32d885f2829c228851e48d0b",
      "ticker": "NWL",
      "status": "resolved",
      "first_tradable_at": "2026-08-07T13:30:00+00:00",
      "entry_price_timestamp": "2026-08-07T13:30:00+00:00",
      "entry_price": 6.050000190734863,
      "entry_price_type": "next_session_open",
      "timezone": "America/New_York",
      "resolved_at": "2026-08-07T18:01:34.797472+00:00"
    },
    {
      "entity_id": "ent_c0f41073ec79a3ae05f3e09e7c0eba8406e41c1a71bc7e682ac7ed9dbe5d1eb9",
      "route_candidate_id": "route_64d5c81f1de38b69287e8b0385b854c6dab3f92804968a222d4cab6734583758",
      "ticker": "GEF",
      "status": "resolved",
      "first_tradable_at": "2026-08-07T13:30:00+00:00",
      "entry_price_timestamp": "2026-08-07T13:30:00+00:00",
      "entry_price": 89.06999969482422,
      "entry_price_type": "next_session_open",
      "timezone": "America/New_York",
      "resolved_at": "2026-08-07T18:01:34.797472+00:00"
    },
    {
      "entity_id": "ent_e6e00d7076fadc960663b0329b707cdf2156057c2b630635069ad5d838860372",
      "route_candidate_id": "route_682de60c2172f478bc9e60262f24f6e494287dbfa98d64aaa32cb1853fc5afda",
      "ticker": "AEHR",
      "status": "resolved",
      "first_tradable_at": "2026-08-07T13:30:00+00:00",
      "entry_price_timestamp": "2026-08-07T13:30:00+00:00",
      "entry_price": 101.66000366210938,
      "entry_price_type": "next_session_open",
      "timezone": "America/New_York",
      "resolved_at": "2026-08-07T18:01:34.797472+00:00"
    },
    {
      "entity_id": "ent_f67260cc9405a177fe0ca3b74a477fa3c3f222f9d802347ae9092ce5e55b74fe",
      "route_candidate_id": "route_86d7473e0b310c8b084a08ad2c24a87976f4ad78a7383291ade146dee796571a",
      "ticker": "UTI",
      "status": "resolved",
      "first_tradable_at": "2026-08-07T13:30:00+00:00",
      "entry_price_timestamp": "2026-08-07T13:30:00+00:00",
      "entry_price": 28.0,
      "entry_price_type": "next_session_open",
      "timezone": "America/New_York",
      "resolved_at": "2026-08-07T18:01:34.797472+00:00"
    },
    {
      "entity_id": "ent_bd70bd57726844650b8ffbeede23e14e95c0aa6a42d61d5a408ac1643f5d8cae",
      "route_candidate_id": "route_885c43cd0fff38439afd919da5c5c20a5bbbfd3a44583e47e9ab583ca74b480e",
      "ticker": "RLJ",
      "status": "resolved",
      "first_tradable_at": "2026-08-07T13:30:00+00:00",
      "entry_price_timestamp": "2026-08-07T13:30:00+00:00",
      "entry_price": 11.979999542236328,
      "entry_price_type": "next_session_open",
      "timezone": "America/New_York",
      "resolved_at": "2026-08-07T18:01:34.797472+00:00"
    },
    {
      "entity_id": "ent_8ce619588a151eb10b8da5c9f80eb3ca81d5c735525acd86df9d448cb58f61a1",
      "route_candidate_id": "route_a08ae742b3d096433953e2a05a8f0fdb882831436241db3f2803a79e5867754f",
      "ticker": "EFOR",
      "status": "resolved",
      "first_tradable_at": "2026-08-07T13:30:00+00:00",
      "entry_price_timestamp": "2026-08-07T13:30:00+00:00",
      "entry_price": 31.899999618530273,
      "entry_price_type": "next_session_open",
      "timezone": "America/New_York",
      "resolved_at": "2026-08-07T18:01:34.797472+00:00"
    },
    {
      "entity_id": "ent_a7382e953b061dac9ada9f1e729bad278623fae88021adbd0155e54ff0e79ab7",
      "route_candidate_id": "route_a67dd6888791dafc2fc4211b607c2e253caa31ccb7e0028d27a1a6437c09c07a",
      "ticker": "LIFE",
      "status": "resolved",
      "first_tradable_at": "2026-08-07T13:30:00+00:00",
      "entry_price_timestamp": "2026-08-07T13:30:00+00:00",
      "entry_price": 29.860000610351562,
      "entry_price_type": "next_session_open",
      "timezone": "America/New_York",
      "resolved_at": "2026-08-07T18:01:34.797472+00:00"
    },
    {
      "entity_id": "ent_686a1e685699ded4bc0c8bfc80ec8006594e47a4b5bc768436470026d6d07229",
      "route_candidate_id": "route_c4bed3bf5cba0c44d762b8d09b1c48e2511d248d60f2a954e6fb14c4a74279b9",
      "ticker": "TRAX",
      "status": "resolved",
      "first_tradable_at": "2026-08-07T13:30:00+00:00",
      "entry_price_timestamp": "2026-08-07T13:30:00+00:00",
      "entry_price": 45.93000030517578,
      "entry_price_type": "next_session_open",
      "timezone": "America/New_York",
      "resolved_at": "2026-08-07T18:01:34.797472+00:00"
    },
    {